{
  "cell_combos": {
    "22": 6,
    "32o": 12,
    "32s": 4,
    "33": 6,
    "42o": 12,
    "42s": 4,
    "43o": 12,
    "43s": 4,
    "44": 6,
    "52o": 12,
    "52s": 4,
    "53o": 12,
    "53s": 4,
    "54o": 12,
    "54s": 4,
    "55": 6,
    "62o": 12,
    "62s": 4,
    "63o": 12,
    "63s": 4,
    "64o": 12,
    "64s": 4,
    "65o": 12,
    "65s": 4,
    "66": 6,
    "72o": 12,
    "72s": 4,
    "73o": 12,
    "73s": 4,
    "74o": 12,
    "74s": 4,
    "75o": 12,
    "75s": 4,
    "76o": 12,
    "76s": 4,
    "77": 6,
    "82o": 12,
    "82s": 4,
    "83o": 12,
    "83s": 4,
    "84o": 12,
    "84s": 4,
    "85o": 12,
    "85s": 4,
    "86o": 12,
    "86s": 4,
    "87o": 12,
    "87s": 4,
    "88": 6,
    "92o": 12,
    "92s": 4,
    "93o": 12,
    "93s": 4,
    "94o": 12,
    "94s": 4,
    "95o": 12,
    "95s": 4,
    "96o": 12,
    "96s": 4,
    "97o": 12,
    "97s": 4,
    "98o": 12,
    "98s": 4,
    "99": 6,
    "A2o": 12,
    "A2s": 4,
    "A3o": 12,
    "A3s": 4,
    "A4o": 12,
    "A4s": 4,
    "A5o": 12,
    "A5s": 4,
    "A6o": 12,
    "A6s": 4,
    "A7o": 12,
    "A7s": 4,
    "A8o": 12,
    "A8s": 4,
    "A9o": 12,
    "A9s": 4,
    "AA": 6,
    "AJo": 12,
    "AJs": 4,
    "AKo": 12,
    "AKs": 4,
    "AQo": 12,
    "AQs": 4,
    "ATo": 12,
    "ATs": 4,
    "J2o": 12,
    "J2s": 4,
    "J3o": 12,
    "J3s": 4,
    "J4o": 12,
    "J4s": 4,
    "J5o": 12,
    "J5s": 4,
    "J6o": 12,
    "J6s": 4,
    "J7o": 12,
    "J7s": 4,
    "J8o": 12,
    "J8s": 4,
    "J9o": 12,
    "J9s": 4,
    "JJ": 6,
    "JTo": 12,
    "JTs": 4,
    "K2o": 12,
    "K2s": 4,
    "K3o": 12,
    "K3s": 4,
    "K4o": 12,
    "K4s": 4,
    "K5o": 12,
    "K5s": 4,
    "K6o": 12,
    "K6s": 4,
    "K7o": 12,
    "K7s": 4,
    "K8o": 12,
    "K8s": 4,
    "K9o": 12,
    "K9s": 4,
    "KJo": 12,
    "KJs": 4,
    "KK": 6,
    "KQo": 12,
    "KQs": 4,
    "KTo": 12,
    "KTs": 4,
    "Q2o": 12,
    "Q2s": 4,
    "Q3o": 12,
    "Q3s": 4,
    "Q4o": 12,
    "Q4s": 4,
    "Q5o": 12,
    "Q5s": 4,
    "Q6o": 12,
    "Q6s": 4,
    "Q7o": 12,
    "Q7s": 4,
    "Q8o": 12,
    "Q8s": 4,
    "Q9o": 12,
    "Q9s": 4,
    "QJo": 12,
    "QJs": 4,
    "QQ": 6,
    "QTo": 12,
    "QTs": 4,
    "T2o": 12,
    "T2s": 4,
    "T3o": 12,
    "T3s": 4,
    "T4o": 12,
    "T4s": 4,
    "T5o": 12,
    "T5s": 4,
    "T6o": 12,
    "T6s": 4,
    "T7o": 12,
    "T7s": 4,
    "T8o": 12,
    "T8s": 4,
    "T9o": 12,
    "T9s": 4,
    "TT": 6
  },
  "checks": [
    {
      "detail": "every cell's combo count is one of 4/6/12",
      "kind": "combo_count",
      "pass": true
    },
    {
      "detail": "frequencies within [0,1]",
      "kind": "frequency_bounds",
      "pass": true
    }
  ],
  "columns": [
    "A",
    "K",
    "Q",
    "J",
    "T",
    "9",
    "8",
    "7",
    "6",
    "5",
    "4",
    "3",
    "2"
  ],
  "id": "range.04-02.mdf-floor-vs-pot",
  "orientation": "akqjt98765432-desc-diagonal-pairs-upper-suited",
  "player": "DEF",
  "provenance": {
    "assumptions": [
      {
        "en": "Which combos clear the floor is chosen by rank order; MDF constrains only the total frequency.",
        "zh": "Which combos clear the floor is chosen by rank order; MDF constrains only the total frequency."
      },
      {
        "en": "MDF 只约束总频率；用哪些组合去达到它，这里按牌力从高到低填充。",
        "zh": "MDF 只约束总频率；用哪些组合去达到它，这里按牌力从高到低填充。"
      }
    ],
    "confidence": "high",
    "derivation_ref": "pokergto.odds#minimum_defense_frequency",
    "kind": "derived",
    "license": "CC-BY-SA-4.0",
    "solver_run": null,
    "upstream": null,
    "verified": true
  },
  "range_percentage": 50.0,
  "rows": [
    "A",
    "K",
    "Q",
    "J",
    "T",
    "9",
    "8",
    "7",
    "6",
    "5",
    "4",
    "3",
    "2"
  ],
  "schema_version": "1.0.0",
  "sizing": null,
  "spot": null,
  "street": "flop",
  "threshold": 0.5,
  "title": {
    "en": "The slice of a range that a pot-sized bet forces you to defend",
    "zh": "面对 pot-sized 下注时必须防守的那部分范围"
  },
  "total_combos": 663.0,
  "unverified_claims": [],
  "weights": {
    "66": 1.0,
    "76o": 1.0,
    "76s": 1.0,
    "77": 1.0,
    "86o": 1.0,
    "86s": 1.0,
    "87o": 1.0,
    "87s": 1.0,
    "88": 1.0,
    "96o": 1.0,
    "96s": 1.0,
    "97o": 1.0,
    "97s": 1.0,
    "98o": 1.0,
    "98s": 1.0,
    "99": 1.0,
    "A5o": 1.0,
    "A5s": 1.0,
    "A6o": 1.0,
    "A6s": 1.0,
    "A7o": 1.0,
    "A7s": 1.0,
    "A8o": 1.0,
    "A8s": 1.0,
    "A9o": 1.0,
    "A9s": 1.0,
    "AA": 1.0,
    "AJo": 1.0,
    "AJs": 1.0,
    "AKo": 1.0,
    "AKs": 1.0,
    "AQo": 1.0,
    "AQs": 1.0,
    "ATo": 1.0,
    "ATs": 1.0,
    "J6o": 1.0,
    "J6s": 1.0,
    "J7o": 1.0,
    "J7s": 1.0,
    "J8o": 1.0,
    "J8s": 1.0,
    "J9o": 1.0,
    "J9s": 1.0,
    "JJ": 1.0,
    "JTo": 1.0,
    "JTs": 1.0,
    "K5o": 1.0,
    "K5s": 1.0,
    "K6o": 1.0,
    "K6s": 1.0,
    "K7o": 1.0,
    "K7s": 1.0,
    "K8o": 1.0,
    "K8s": 1.0,
    "K9o": 1.0,
    "K9s": 1.0,
    "KJo": 1.0,
    "KJs": 1.0,
    "KK": 1.0,
    "KQo": 1.0,
    "KQs": 1.0,
    "KTo": 1.0,
    "KTs": 1.0,
    "Q5s": 0.25,
    "Q6o": 1.0,
    "Q6s": 1.0,
    "Q7o": 1.0,
    "Q7s": 1.0,
    "Q8o": 1.0,
    "Q8s": 1.0,
    "Q9o": 1.0,
    "Q9s": 1.0,
    "QJo": 1.0,
    "QJs": 1.0,
    "QQ": 1.0,
    "QTo": 1.0,
    "QTs": 1.0,
    "T6o": 1.0,
    "T6s": 1.0,
    "T7o": 1.0,
    "T7s": 1.0,
    "T8o": 1.0,
    "T8s": 1.0,
    "T9o": 1.0,
    "T9s": 1.0,
    "TT": 1.0
  }
}
